{
  "boundaries": [
    {
      "field": "YY-YEAR",
      "id": "year-pivot-score-03-change-verification-below",
      "kind": "pivot_minus_one",
      "records": [
        {
          "TODAY-YEAR": "2026",
          "YEAR-DENOM": "3",
          "YY-YEAR": "49"
        },
        {
          "TODAY-YEAR": "2026",
          "YEAR-DENOM": "3",
          "YY-YEAR": "49"
        }
      ],
      "scenario": "records"
    },
    {
      "field": "YY-YEAR",
      "id": "year-pivot-score-03-change-verification-at",
      "kind": "pivot",
      "records": [
        {
          "TODAY-YEAR": "2026",
          "YEAR-DENOM": "3",
          "YY-YEAR": "50"
        },
        {
          "TODAY-YEAR": "2026",
          "YEAR-DENOM": "3",
          "YY-YEAR": "50"
        }
      ],
      "scenario": "records"
    },
    {
      "field": "YY-YEAR",
      "id": "year-pivot-score-03-change-verification-above",
      "kind": "pivot_plus_one",
      "records": [
        {
          "TODAY-YEAR": "2026",
          "YEAR-DENOM": "3",
          "YY-YEAR": "51"
        },
        {
          "TODAY-YEAR": "2026",
          "YEAR-DENOM": "3",
          "YY-YEAR": "51"
        }
      ],
      "scenario": "records"
    },
    {
      "field": "YEAR-DENOM",
      "id": "year-pivot-score-03-change-verification-zero-divisor",
      "kind": "zero",
      "records": [
        {
          "TODAY-YEAR": "2026",
          "YEAR-DENOM": "0",
          "YY-YEAR": "30"
        },
        {
          "TODAY-YEAR": "2026",
          "YEAR-DENOM": "0",
          "YY-YEAR": "30"
        }
      ],
      "scenario": "records"
    },
    {
      "field": "YEAR-DENOM",
      "id": "year-pivot-score-03-change-verification-least-divisor",
      "kind": "least_unit",
      "records": [
        {
          "TODAY-YEAR": "2026",
          "YEAR-DENOM": "1",
          "YY-YEAR": "30"
        },
        {
          "TODAY-YEAR": "2026",
          "YEAR-DENOM": "1",
          "YY-YEAR": "30"
        }
      ],
      "scenario": "records"
    }
  ],
  "collision_counter": 0,
  "corpus_version": "m10-dev-source-r4",
  "family_id": "dev_year_pivot_score",
  "fields_sha256": "85b820bc3bd31a37c912b6854714c2788352710b3e1dc81a5792b715233aca62",
  "fill": {
    "algorithm": "sha256-counter-v1",
    "max_records": 2,
    "seed_material": [
      "m10-dev-source-r4",
      "dev_year_pivot_score",
      "year-pivot-score-03",
      "year-pivot-score-03-change",
      "verification"
    ],
    "target_count": 128
  },
  "manifest_version": 1,
  "partition": "verification",
  "program_id": "year-pivot-score-03",
  "records": [
    {
      "TODAY-YEAR": "2026",
      "YEAR-DENOM": "3",
      "YY-YEAR": "30"
    },
    {
      "TODAY-YEAR": "2026",
      "YEAR-DENOM": "3",
      "YY-YEAR": "30"
    }
  ],
  "scenario": "records",
  "task_id": "year-pivot-score-03-change"
}
