{
  "boundaries": [
    {
      "field": null,
      "id": "fee-tier-04-original-loop-empty",
      "kind": "eof",
      "records": [],
      "scenario": "empty"
    },
    {
      "field": "AMOUNT",
      "id": "fee-tier-04-original-loop-below",
      "kind": "threshold_below",
      "records": [
        {
          "AMOUNT": "54.99",
          "SIGNED-DEBT": "-1.25"
        }
      ],
      "scenario": "records"
    },
    {
      "field": "AMOUNT",
      "id": "fee-tier-04-original-loop-at",
      "kind": "threshold",
      "records": [
        {
          "AMOUNT": "55.00",
          "SIGNED-DEBT": "-1.25"
        }
      ],
      "scenario": "records"
    },
    {
      "field": "AMOUNT",
      "id": "fee-tier-04-original-loop-above",
      "kind": "threshold_above",
      "records": [
        {
          "AMOUNT": "55.01",
          "SIGNED-DEBT": "-1.25"
        }
      ],
      "scenario": "records"
    },
    {
      "field": "AMOUNT",
      "id": "fee-tier-04-original-loop-least",
      "kind": "least_unit",
      "records": [
        {
          "AMOUNT": "0.01",
          "SIGNED-DEBT": "-1.25"
        }
      ],
      "scenario": "records"
    },
    {
      "field": "SIGNED-DEBT",
      "id": "fee-tier-04-original-loop-negative",
      "kind": "negative",
      "records": [
        {
          "AMOUNT": "1.01",
          "SIGNED-DEBT": "-1.25"
        }
      ],
      "scenario": "records"
    },
    {
      "field": "SIGNED-DEBT",
      "id": "fee-tier-04-original-loop-negzero",
      "kind": "negative_zero",
      "records": [
        {
          "AMOUNT": "1.01",
          "SIGNED-DEBT": "-0.00"
        }
      ],
      "scenario": "records"
    },
    {
      "field": "AMOUNT",
      "id": "fee-tier-04-original-loop-max",
      "kind": "field_max",
      "records": [
        {
          "AMOUNT": "999.99",
          "SIGNED-DEBT": "-1.25"
        }
      ],
      "scenario": "records"
    }
  ],
  "collision_counter": 0,
  "corpus_version": "m10-dev-source-r4",
  "family_id": "dev_decimal_tier",
  "fields_sha256": "aade55f245836bdc7d5bfaa6e556e4dc4fdb59510f9eb61a1e35051e03bd552c",
  "fill": {
    "algorithm": "sha256-counter-v1",
    "max_records": 2,
    "seed_material": [
      "m10-dev-source-r4",
      "dev_decimal_tier",
      "fee-tier-04",
      "fee-tier-04-original",
      "loop"
    ],
    "target_count": 32
  },
  "manifest_version": 1,
  "partition": "loop",
  "program_id": "fee-tier-04",
  "records": [],
  "scenario": "missing",
  "task_id": "fee-tier-04-original"
}
