{
  "boundaries": [
    {
      "field": null,
      "id": "fee-tier-01-change-loop-empty",
      "kind": "eof",
      "records": [],
      "scenario": "empty"
    },
    {
      "field": "AMOUNT",
      "id": "fee-tier-01-change-loop-below",
      "kind": "threshold_below",
      "records": [
        {
          "AMOUNT": "44.99",
          "SIGNED-DEBT": "-1.25"
        }
      ],
      "scenario": "records"
    },
    {
      "field": "AMOUNT",
      "id": "fee-tier-01-change-loop-at",
      "kind": "threshold",
      "records": [
        {
          "AMOUNT": "45.00",
          "SIGNED-DEBT": "-1.25"
        }
      ],
      "scenario": "records"
    },
    {
      "field": "AMOUNT",
      "id": "fee-tier-01-change-loop-above",
      "kind": "threshold_above",
      "records": [
        {
          "AMOUNT": "45.01",
          "SIGNED-DEBT": "-1.25"
        }
      ],
      "scenario": "records"
    },
    {
      "field": "AMOUNT",
      "id": "fee-tier-01-change-loop-least",
      "kind": "least_unit",
      "records": [
        {
          "AMOUNT": "0.01",
          "SIGNED-DEBT": "-1.25"
        }
      ],
      "scenario": "records"
    },
    {
      "field": "SIGNED-DEBT",
      "id": "fee-tier-01-change-loop-negative",
      "kind": "negative",
      "records": [
        {
          "AMOUNT": "1.01",
          "SIGNED-DEBT": "-1.25"
        }
      ],
      "scenario": "records"
    },
    {
      "field": "SIGNED-DEBT",
      "id": "fee-tier-01-change-loop-negzero",
      "kind": "negative_zero",
      "records": [
        {
          "AMOUNT": "1.01",
          "SIGNED-DEBT": "-0.00"
        }
      ],
      "scenario": "records"
    },
    {
      "field": "AMOUNT",
      "id": "fee-tier-01-change-loop-max",
      "kind": "field_max",
      "records": [
        {
          "AMOUNT": "999.99",
          "SIGNED-DEBT": "-1.25"
        }
      ],
      "scenario": "records"
    }
  ],
  "collision_counter": 0,
  "corpus_version": "m10-dev-source-r4",
  "family_id": "dev_decimal_tier",
  "fields_sha256": "168d8b301bd9be20b26de031df2a4051d1a190a77ada770d9b7c611bcc416d1e",
  "fill": {
    "algorithm": "sha256-counter-v1",
    "max_records": 2,
    "seed_material": [
      "m10-dev-source-r4",
      "dev_decimal_tier",
      "fee-tier-01",
      "fee-tier-01-change",
      "loop"
    ],
    "target_count": 32
  },
  "manifest_version": 1,
  "partition": "loop",
  "program_id": "fee-tier-01",
  "records": [],
  "scenario": "missing",
  "task_id": "fee-tier-01-change"
}
