{
  "boundaries": [
    {
      "field": null,
      "id": "year-century-04-original-loop-empty",
      "kind": "eof",
      "records": [],
      "scenario": "empty"
    },
    {
      "field": "YY-YEAR",
      "id": "year-century-04-original-loop-year-zero",
      "kind": "zero",
      "records": [
        {
          "SIGNED-DELTA": "-1",
          "TODAY-YEAR": "2026",
          "YY-YEAR": "0"
        }
      ],
      "scenario": "records"
    },
    {
      "field": "YY-YEAR",
      "id": "year-century-04-original-loop-year-max",
      "kind": "field_max",
      "records": [
        {
          "SIGNED-DELTA": "-1",
          "TODAY-YEAR": "2026",
          "YY-YEAR": "99"
        }
      ],
      "scenario": "records"
    },
    {
      "field": "SIGNED-DELTA",
      "id": "year-century-04-original-loop-negative",
      "kind": "negative",
      "records": [
        {
          "SIGNED-DELTA": "-1",
          "TODAY-YEAR": "2026",
          "YY-YEAR": "24"
        }
      ],
      "scenario": "records"
    },
    {
      "field": "SIGNED-DELTA",
      "id": "year-century-04-original-loop-negzero",
      "kind": "negative_zero",
      "records": [
        {
          "SIGNED-DELTA": "-0",
          "TODAY-YEAR": "2026",
          "YY-YEAR": "24"
        }
      ],
      "scenario": "records"
    }
  ],
  "collision_counter": 0,
  "corpus_version": "m10-dev-source-r4",
  "family_id": "dev_year_century",
  "fields_sha256": "ab2ba7dd6ba35ab92aa0a7aff1cd17e67ec9a3803afa5b8a0735e046f212f16f",
  "fill": {
    "algorithm": "sha256-counter-v1",
    "max_records": 2,
    "seed_material": [
      "m10-dev-source-r4",
      "dev_year_century",
      "year-century-04",
      "year-century-04-original",
      "loop"
    ],
    "target_count": 32
  },
  "manifest_version": 1,
  "partition": "loop",
  "program_id": "year-century-04",
  "records": [],
  "scenario": "missing",
  "task_id": "year-century-04-original"
}
