{
  "boundaries": [
    {
      "field": null,
      "id": "status-fallback-03-change-loop-empty",
      "kind": "eof",
      "records": [],
      "scenario": "empty"
    },
    {
      "field": "PAYLOAD",
      "id": "status-fallback-03-change-loop-full-width",
      "kind": "field_max",
      "records": [
        {
          "PAYLOAD": "ABCDEF"
        }
      ],
      "scenario": "records"
    }
  ],
  "collision_counter": 0,
  "corpus_version": "m10-dev-source-r4",
  "family_id": "dev_status_fallback",
  "fields_sha256": "89d911282f4aa41297bc9efedce7e55b692835309c9914c2ef293a794debd994",
  "fill": {
    "algorithm": "sha256-counter-v1",
    "max_records": 2,
    "seed_material": [
      "m10-dev-source-r4",
      "dev_status_fallback",
      "status-fallback-03",
      "status-fallback-03-change",
      "loop"
    ],
    "target_count": 32
  },
  "manifest_version": 1,
  "partition": "loop",
  "program_id": "status-fallback-03",
  "records": [],
  "scenario": "missing",
  "task_id": "status-fallback-03-change"
}
