{
  "boundaries": [
    {
      "field": null,
      "id": "status-two-read-01-original-loop-empty",
      "kind": "eof",
      "records": [],
      "scenario": "empty"
    },
    {
      "field": null,
      "id": "status-two-read-01-original-loop-one-row",
      "kind": "eof",
      "records": [
        {
          "PAYLOAD": "ABCDE"
        }
      ],
      "scenario": "records"
    },
    {
      "field": "PAYLOAD",
      "id": "status-two-read-01-original-loop-full-width",
      "kind": "field_max",
      "records": [
        {
          "PAYLOAD": "ABCDE"
        },
        {
          "PAYLOAD": "ABCDE"
        }
      ],
      "scenario": "records"
    },
    {
      "field": null,
      "id": "status-two-read-01-original-loop-ordered",
      "kind": "eof",
      "records": [
        {
          "PAYLOAD": "ABCDE"
        },
        {
          "PAYLOAD": "FGHIJ"
        }
      ],
      "scenario": "records"
    }
  ],
  "collision_counter": 0,
  "corpus_version": "m10-dev-source-r4",
  "family_id": "dev_status_two_read",
  "fields_sha256": "3d554942928d11e3543c35c6059cf8ef1edcfd515fe464d13bfd8ea6fa8daf25",
  "fill": {
    "algorithm": "sha256-counter-v1",
    "max_records": 2,
    "seed_material": [
      "m10-dev-source-r4",
      "dev_status_two_read",
      "status-two-read-01",
      "status-two-read-01-original",
      "loop"
    ],
    "target_count": 32
  },
  "manifest_version": 1,
  "partition": "loop",
  "program_id": "status-two-read-01",
  "records": [],
  "scenario": "missing",
  "task_id": "status-two-read-01-original"
}
